title,creator,date,youtubeId,tags
Keystone Hardware Wallet Tutorial,theBTCcourse,4/4/23,r-gzk6laFH4,"Keystone,Sparrow"
DIY Bitcoin Hardware Wallet Running Blockstream Jade Firmware (ESP 32),Crypto Guide,4/2/23,PeqP6oVnlIs,Jade
IBEXPay: The Easiest Way to Accept Bitcoin Lightning Payments,Ian Major,3/31/23,q_maOYxBtbs,"IBEXPay,Lightning"
Keystone Wallet Review & Tutorial,Darren Honeysett,5/30/23,Y32m1B8YcvY,Keystone
How to Buy Bitcoin on the Bisq Network (Non-KYC),theBTCcourse,3/30/23,nU1s1Rk3no8,"Bisq,Non-KYC"
Exploring the Blockstream Jade QR Scan,Blockstream,3/23/23,Cvm0zUCvfMo,"Jade,SeedQR,Nunchuk"
How to Buy & Sell Bitcoin on Robosats (Non-KYC),theBTCcourse,3/21/23,52snf3x2KKA,"Robosats,Non-KYC"
Bitcoin Multisig Wallet with Casa,theBTCcourse,3/16/23,6zPYnkRGi-4,"Casa,Multisig,Trezor One"
Bitcoin Multisig Wallet with Unchained Capital,theBTCcourse,3/15/23,iscBOtm9dVs,"Unchained/Caravan,Multisig,Ledger Nano(S/X)"
BTCPay Coinjoin Scientist Mode Explained,Wasabi Wallet,3/15/23,g5nFckPfPcA,"BTCPay Server,Coinjoin (Wabisabi)"
Trezor Hardware Wallet Tutorial,theBTCcourse,3/14/23,TJOHrxE-Fp4,"Trezor One,Sparrow"
How to Fix Your Raspberry Pi 4 Umbrel OS,Rhett Reisman,3/13/23,RoQZc6pTolI,"Umbrel,Bitcoin Core,Lightning"
Blockstream Jade: Hardware Wallet Review,Chris Bagnell,3/13/23,p7bax7FxxTE,"Jade,Blockstream App"
BTCPay Server- How to Connect Your Hardware Wallet with BTCPay Vault,BTCPay Server,3/9/23,s4qbGxef43A,"BTCPay Server,Jade"
How to Safely Update Sparrow Wallet: Download and Verify Latest Version,Southern Bitcoiner,3/8/23,IThaolnDgSo,"Sparrow, Verifying Downloads"
Unchained Capital Caravan Multisig Wallet,Rhett Reisman,3/6/23,rhEJJ8jrEoI,"Unchained/Caravan,Ledger Nano(S/X),Trezor T,ColdCard MK(1-4),Multisig"
How to Coinjoin in BTCPay Server,Wasabi Wallet,3/1/23,zGVCrwMKKn0,"BTCPay Server,Coinjoin (Wabisabi)"
Using Passport Hardware Wallet with Bitcoin Keeper- Multisig,Foundation,3/1/23,NGSRMoGZn-w,"Passport Core,Bitcoin Keeper,Multisig"
Cashu Tutorial- Chaumian Ecash on Bitcoin,BTC Sessions,2/27/23,riTRD0BdMDI,"Cashu,Nutstash,LNbits"
Alby: Connecting Your Web Browser to the Bitcoin Lightning Network,Ian Major,2/24/23,eYlFHTGZhq4,"Alby,Bitrefill"
BIP 85: Offensive Entropy Pt 2,justh0dl,2/20/23,qL_jQU3rw-Q,Child Seeds (BIP 85)
Using Passport Hardware Wallet with Specter Desktop,Foundation,2/14/23,U_EntPUO4yY,"Passport Core,Specter Desktop"
How to Set Up a New KeepKey,KeepKey,2/13/23,js6VMMvz9aQ,KeepKey
BIP 85: Offensive Entropy,justh0dl,2/12/23,dOkyDHeYbhQ,Child Seeds (BIP 85)
Blockstream Jade Airgapped- Bitcoin Hardware Wallet,Bitcoiner Malaysia,2/11/23,UhysvX2sLoQ,"Jade,Blockstream App,BlueWallet"
How to Accept Bitcoin Lightning Payments for E-Commerce,Ian Major,2/10/23,gocNXNe5DT4,"Voltage,Lightning Network Daemon (LND),BTCPay Server"
Using an Old Phone as a Hardware Wallet,BTC Sessions,2/8/23,f-8elm8xCLs,"BlueWallet,Sparrow,Signing Devices (General)"
Entropia- Generate Permissionless Bitcoin Wallets,BTC Sessions,2/1/23,dCAr2urEe1o,"Seed Phrases (General),SeedSigner,SeedQR,Nunchuk"
How to Use Sparrow & Cold Storage Options,88 Sats Radio,2/1/23,DjAF_jkSQeE,Sparrow
How to Securely Set Up a Trezor Model T,Rhett Reisman,1/30/23,whFsn8KxFkA,Trezor T
Using Passport Hardware Wallet with Nunchuk Mobile,Foundation,1/27/23,NG4pQKrGgVQ,"Passport Core,Nunchuk"
Simple Bitcoin Inheritance Planning with Nunchuk,BTC Sessions,1/26/23,kizqvBY4zPE,"Nunchuk,Multisig,Jade,Tapsigner,ColdCard MK(1-4)"
Using Passport Hardware Wallet with Sparrow Desktop Wallet,Foundation,1/23/23,tbT6tlr0uyk,"Passport Core,Sparrow"
Wasabi Wallet: How to Send & Receive Bitcoin,Wasabi Wallet,1/20/23,UbOAbXjzBJg,"Wasabi,Coinjoin (Wabisabi)"
BTCPay Server Setup on Digital Ocean Full Guide,Vasker Media,1/14/23,Ephzh9UzHHg,BTCPay Server
Joinmarket: JAM App for Easy BTC Coinjoin,BTC Sessions,1/13/23,FbyjG2upGO8,"JAM,Coinjoin (JoinMarket),Start9"
How to Connect Sparrow Wallet to a Bitcoin Core Node,Southern Bitcoiner,1/9/23,9Aw6OAXxE_Y,"Sparrow,Bitcoin Core"
Krux on M5StickV + Sparrow Wallet,Crypto Guide,1/6/23,rsdvmIcucwQ,"Krux,Sparrow"
Blockstream Jade: How to Reset and Restore via SeedQR,Bitcoiner Malaysia,1/6/23,rT1SThvKFeo,"Jade,SeedQR"
"Create a Bitcoin Wallet + Seed Phrase with Dice, Pen and Paper",BTC Sessions,1/4/23,LxTkLwpV1Po,"Seed Phrases (General),SeedSigner"
Blockstream Jade,KF Chan,1/3/23,8rr7dF2F8t0,"Jade,SeedQR,Blockstream App"
Keystone Hardware Wallet: Security Meets Usability,Ian Major,12/31/22,KXcyhFyuvhI,Keystone
Multisig Demo using Tapsigner + Ledger + Seedsigner + ColdCard,Bithyve,12/30/22,uhpLbFfMEZU,"Bitcoin Keeper,Tapsigner,Ledger Nano(S/X),SeedSigner,ColdCard MK(1-4),Passport Core"
BTCPayServer and ColdCard Wallet,BTCPay Server,12/28/22,XyqvYaXMfNU,"BTCPay Server,ColdCard MK(1-4)"
Keeper Demo: Tapsigner + Signing Server + Mobile Key,Bithyve,12/14/22,P3-dXCSypBs,"Bitcoin Keeper,Tapsigner,Multisig"
Bitcoin Keeper Demo: SeedSigner + Jade + Tapsigner,Bithyve,12/14/22,Wp5K4TO04u4,"Bitcoin Keeper,SeedSigner,Jade,Tapsigner"
Non-KYC Bitcoin Direct to Your Trezor (Hodl Hodl Integration),BTC Sessions,12/14/22,8S7fvl1X07k,"Hodl Hodl,Trezor One,Trezor T,Trezor Safe,Non-KYC"
Krux on Maix Amigo + Blue Wallet,Crypto Guide,12/9/22,EtV_Iw6a0O0,"Krux,BlueWallet,Verifying Downloads"
Start9 Embassy: Bitcoin Node and Personal Server Tutorial,BTC Sessions,12/6/22,DKBJ3_3ZomU,"Start9,Bitcoin Core,Sparrow,Specter Desktop,Ride The Lightning"
How to Setup and Use Electrum Wallet,Tech Express,12/4/22,ZGLWPFmYwrY,Electrum
Peach Bitcoin Tutorial: Buy P2P Bitcoin,Crypto Friday,12/2/22,T0ksHU40uro,"Peach,Non-KYC"
Foundation Passport Bitcoin Hardware Wallet,Ian Major,11/18/22,ew0Pv0n7buA,"Passport Core,Envoy"
How to Create a Bitcoin Timelocked Address,Bitcoin Education,11/15/22,lW-l73AV0wI,"Timelocks,Electrum"
How to Set Up a Trezor Hardware Wallet,Trezor,11/10/22,HuVH_9hnUu8,Trezor T
Update Passport Firmware From Your Phone with Envoy,Foundation,11/9/22,tH63FUlROZ8,"Passport Core,Envoy"
Satscard Tutorial and Review,Darren Honeysett,11/6/22,ExZJtBpcMXw,"Satscard,Nunchuk"
BlueWallet Multisig Review,Rhett Reisman,10/24/22,T93Vm6fB3vs,"BlueWallet,Multisig,ColdCard MK(1-4)"
Wasabi Wallet: How To Send Bitcoin,Wasabi Wallet,10/18/22,vCI5aza-lv0,Wasabi
Keeper Demo: ColdCard + Tapsigner + Ledger,Bithyve,10/13/22,Pj9EDgu1FD8,"Bitcoin Keeper,ColdCard MK(1-4),Tapsigner,Ledger Nano(S/X)"
Wasabi Wallet: How to Receive Bitcoin,Wasabi Wallet,10/6/22,Wjc00GBn-OQ,Wasabi
Sending Bitcoin from Jade to Green,Blockstream,10/6/22,TfLaw8ai-Ws,"Jade,Blockstream App"
ColdCard- Use Your Bitcoin Hardware with NFC,BTC Sessions,10/5/22,eLG8Atcd-l4,"ColdCard MK(1-4),Nunchuk,Multisig"
Using Passport Hardware Wallet with BTCPay Server,Foundation,10/4/22,ZlSiBtEiSA4,"Passport Core,BTCPay Server"
Using myNode,MyNode,10/3/22,c3rTlalVDEA,MyNode
Nunchuk Collaborative Bitcoin Wallet with SeedSigner (Multisig),Hardcore Bitcoiner,10/1/22,K6RUZQCSo3k,"Nunchuk,Multisig,SeedSigner"
Wasabi Wallet: How to Install and Create a Wallet,Wasabi Wallet,9/30/22,QHIpEYYqddE,Wasabi
How to Verify Signatures with GPG,BTC Sessions,9/30/22,U0I-ImS_r8o,"Verifying Downloads,Specter Desktop"
Practice Bitcoin Self-Custody with Passport and Envoy,Foundation,9/30/22,nRGFAHlYIeU,"Passport Core,Envoy"
Satscard Beginner Guide: How to Anonymously Pass Bitcoin Along,Coinkite,9/29/22,u_JWnWxiVlg,"Satscard,Nunchuk"
Privacy Options in Blockstream Green,Blockstream,9/29/22,aqer3iKXyO0,"Blockstream App,Electrum Rust Server (Electrs),Umbrel"
DIY Trezor One,Crypto Guide,9/26/22,t9zNOsTXjvo,"Trezor One,Verifying Downloads"
Umbrel- How to Use Your Bitcoin and Lightning Node,BTC Sessions,9/23/22,Fa9AvF4jk1o,"Umbrel,Sparrow,Bitcoin Core,Electrum Rust Server (Electrs),Lightning Network Daemon (LND),Zeus"
Passport Hardware Wallet- Manual Setup,Foundation,9/23/22,UKzMHsjJFYU,Passport Core
Satscard Tabletop Guide w/ Nunchuk,Coinkite,9/22/22,h-hJz9hZgLQ,"Satscard,Nunchuk"
Foundation Passport: Bitcoin Hardware Wallet/Signing Device Tutorial,BTC Sessions,9/9/22,_uGZHg64wwA,"Passport Core,Envoy,BlueWallet,Encrypted Backups"
Tapsigner Tabletop Guide w/ Nunchuk,Coinkite,9/21/22,NJkCcnpne9Q,"Tapsigner,Nunchuk"
Unchained Capital Review and Multisig Vault Tutorial,Rhett Reisman,9/19/22,V1Krw5dZc28,"Unchained/Caravan,Multisig,Ledger Nano(S/X),ColdCard MK(1-4)"
Raspiblitz,BTC Sessions,9/18/22,DTHlSPMz3ns,"Raspiblitz,Ride The Lightning"
LNbits: The Most Powerful App For Your Bitcoin Lightning Node,Jonathan Levi,9/14/22,ZTjFalYeOlA,LNbits
Nunchuk Tutorial: Collaborative Bitcoin Multisig Made Easy,Ian Major,9/8/22,ZE8F7laSX84,"Nunchuk,Verifying Downloads,Ledger Nano(S/X),Multisig"
BlueWallet ColdCard MK4 Tutorial,Rhett Reisman,9/5/22,wnuhdQWytls,"BlueWallet,ColdCard MK(1-4)"
Blockstream Jade Passphrases,Blockstream,8/29/22,QKczFUUcXw4,Jade
BTCPay Server- Setup an Automatic Email When a Payment is Received,BTCPay Server,8/24/22,RylpDWt30uc,BTCPay Server
Tapsigner Beginner Guide: How to Use with Nunchuk Wallet,Coinkite,8/23/22,wTX-wZGGDsE,"Tapsigner,Nunchuk"
Easily Set up a Bitcoin Node on a Raspberry Pi 4: Umbrel,Luke's Tech,8/20/22,fO_SoWeeIRI,"Umbrel,Bitcoin Core"
JAM: Revamped UI for JoinMarket P2P Coinjoin,Ian Major,8/20/22,iWFBHgEiBIY,"JAM,Coinjoin (JoinMarket),Umbrel"
Download Envoy from F-Droid,Foundation,8/17/22,KW3qYZ83ZGA,Envoy
Connecting Envoy to Your Own Bitcoin Node,Foundation,8/17/22,kKWAaVaGsN4,"Electrum Rust Server (Electrs),Envoy"
No KYC Bitcoin: How to Buy Bitcoin Privately,Jonathan Levi,8/16/22,PtASu0oTadA,"Non-KYC,Bisq"
ColdCard MK4 Setup Tutorial,Rhett Reisman,8/15/22,YeEy7pOre04,"ColdCard MK(1-4),Sparrow"
BitBox02 Bitcoin Hardware Wallet,Jonathan Levi,8/9/22,AUUj0tdZ7uU,BitBox
SeedSigner- Raspberry Pi Based DIY Bitcoin Hardware Wallet,Crypto Guide,8/4/22,1c5SR8v8l1M,"SeedSigner,Verifying Downloads,BlueWallet,SeedQR"
Tapsigner from Coinkite- NFC Bitcoin Cold Storage,BTC Sessions,8/2/22,xKHy1HMw5iU,"Tapsigner,Nunchuk,Multisig"
Using PIN Security Words on Passport,Foundation,7/27/22,1EjGq_Pah30,Passport Core
Blockstream Jade Hardware Wallet- Tutorial & Review,Darren Honeysett,7/25/22,HMBm75b_wGk,"Jade,Blockstream App"
BIP 85: Password ColdCard Demo,Coinkite,7/22/22,cE948LgzADM,"ColdCard MK(1-4), Child Seeds (BIP 85)"
Managing Multiple Bitcoin Accounts with Passport,Foundation,7/22/22,9cfmXTXEVgw,"Passport Core,Envoy"
Self-Custody Bitcoin Offline in Blockstream Jade,Blockstream,7/19/22,Xuk85w-58EE,"Jade,Blockstream App"
ColdCard MK4 Full Step-by-Step Tutorial (w/ Sparrow Wallet Pairing),Ian Major,7/18/22,7dNGdkeQ7ew,"ColdCard MK(1-4),Verifying Downloads,Sparrow"
Passport Unboxing Pt. 2,Foundation,7/18/22,IXj-s-7odFQ,Passport Core
Connecting Passport with Envoy,Foundation,7/18/22,x-EERNXlvrc,"Passport Core,Envoy"
Bisq on Tails,402 Payment Required,7/7/22,r28qe_uXl4w,"Bisq,Verifying Downloads"
LNBits Lightning Wallet Toolkit,BTC Sessions,7/4/22,9cvxCL4ADE4,"LNbits,Voltage"
Cool Bitcoin S^*t Ep. 4: Back Up and Encrypt Bitcoin Core,Bitcoin Takeover,7/2/22,7o10OvOxDDI,"Bitcoin Core,Encrypted Backups"
Bitcoin & Lightning Server,402 Payment Required,7/2/22,_Hrnls92TxQ,"Bitcoin Core,Core Lightning,Electrum Rust Server (Electrs),Ride The Lightning,Verifying Downloads"
How to Setup and Use Electrum Wallet,The Social Guide,6/28/22,SLE2T0AKQfc,Electrum
RoboSats: Non-KYC Bitcoin P2P Over the Lightning Network,Ian Major,6/24/22,QISRoZxQaAs,"Robosats,Non-KYC,Lightning"
ColdCard Bitcoin Hardware Wallet- Full Tutorial,BTC Sessions,6/22/22,FAYmE5-40PQ,"ColdCard MK(1-4),Sparrow"
Wasabi Wallet 2.0: Unboxing & Tutorial,Wasabi Wallet,6/15/22,bQKU2khua-8,"Wasabi,Coinjoin (Wabisabi)"
Blockstream Jade- Mobile Bitcoin Hardware Wallet,BTC Sessions,6/14/22,_U1jsTeqbTw,"Jade,Blockstream App"
Self-Custody in Blockstream Green,Blockstream,6/7/22,pXU0ZHX0WpA,"Jade,Blockstream App,Liquid"
Core Lightning (Part 5): Spark Server & Wallet,402 Payment Required,6/4/22,sDM-qUBucZI,"Core Lightning,Spark,Verifying Downloads"
"Core Lightning (Part 4): Ride the Lightning and Zeus, over Tor",402 Payment Required,6/3/22,6xNYsU1F_IQ,"Core Lightning,Ride The Lightning,Zeus"
Core Lightning (Part 3): Ride the Lightning,402 Payment Required,6/1/22,rSyYCj0mtuc,"Core Lightning,Ride The Lightning,Verifying Downloads"
Unchained Capital- Multisig Bitcoin Vaults,BTC Sessions,5/31/22,ToMYVLrcKgo,"Unchained/Caravan,Multisig,ColdCard MK(1-4),Ledger Nano(S/X),Trezor T,Sparrow"
Raspiblitz Node Zeus Setup Guide,Bitcoin Brandon,5/30/22,f6PJHJA9YJM,"Raspiblitz,Ride The Lightning,Zeus"
Core Lightning (Part 2): Plugins,402 Payment Required,5/30/22,LDyAH4ZM8VY,Core Lightning
myNode Setup,MyNode,5/29/22,zjaM8Vhe3JU,MyNode
Core Lightning (Part 1): Setup and Backup,402 Payment Required,5/28/22,fvB1SmY-y98,"Core Lightning,Verifying Downloads"
Electrum Server (Part 2): Connect to Electrum Server Remotely,402 Payment Required,5/25/22,IbOxgdHsyRI,"Electrum Rust Server (Electrs),Electrum"
Umbrel Bitcoin Node Setup,Bitcoin Brandon,5/23/22,fbH4o_uK8-M,Umbrel
"Electrum Server (Part 1): Downloading, Verifying and Connecting Electrum Wallet",402 Payment Required,5/22/22,mbG7hBMWQrs,"Electrum Rust Server (Electrs),Verifying Downloads,Electrum"
Blixt Wallet: A Cutting-Edge Non-Custodial Bitcoin Lightning Wallet,Ian Major,5/20/22,5JyOAeaCN0o,"Blixt,Lightning"
Ubuntu Node Box: Fulcrum Server,Ministry of Nodes,5/11/22,SpQRrbJt7cg,"Fulcrum,Ubuntu Node Box"
Ubuntu Node Box: Sparrow Wallet,Ministry of Nodes,5/11/22,9dcXXz1CHV8,"Sparrow,Ubuntu Node Box"
Ubuntu Node Box: Make Your BTCPay Server Public,Ministry of Nodes,5/11/22,LwMLVAtuiA4,"BTCPay Server,Ubuntu Node Box"
Ubuntu Node Box: BTCPay Server,Ministry of Nodes,5/11/22,rSw7DaTsjhA,"BTCPay Server,Ubuntu Node Box"
Ubuntu Node Box: Lightning Network Daemon (LND),Ministry of Nodes,5/11/22,UMXS7u4RHwI,"Lightning Network Daemon (LND),Ubuntu Node Box"
Ubuntu Node Box: Ride The Lightning,Ministry of Nodes,5/11/22,T0UYZOChn3M,"Ride The Lightning,Ubuntu Node Box,Lightning Network Daemon (LND)"
Ubuntu Node Box: Zeus Wallet,Ministry of Nodes,5/11/22,bRzkxzgMfLg,"Ubuntu Node Box,Zeus,Lightning Network Daemon (LND)"
Ubuntu Node Box: ThunderHub,Ministry of Nodes,5/11/22,jVGxrXC5osE,"Ubuntu Node Box,ThunderHub"
Lightning Terminal Overview (Pool & Loop),Ian Major,5/6/22,7hzP7fx_3is,"Umbrel,Lightning Node Connect,Loop,Pool"
Ronin Dojo- A Bitcoin Node for Privacy,BTC Sessions,5/4/22,hI9ozPq1GlQ,"RoninDojo,Coinjoin (Whirlpool)"
Fountain: Podcasting 2.0,BTC Sessions,4/27/22,IxuCGPGgMZg,"Fountain,Lightning"
BitBox Tutorial 02,Plan B Network,4/19/22,UTqCxssV-54,BitBox
BTCPay Server- Accept Bitcoin Payments in Minutes,BTC Sessions,4/18/22,KqsM-n-e4aY,"BTCPay Server,Lightning Network Daemon (LND)"
Coin Control in Blockstream Green,Blockstream,4/18/22,Ddin_1ymaBc,"Blockstream App,UTXO Management"
Robosats- Buy and Sell Bitcoin with No ID,BTC Sessions,4/13/22,XW_wzRz_BDI,"Robosats,Non-KYC,Lightning"
How to Set Up Your Bitcoin Blue Wallet,Plan B Network,4/5/22,QwEOgRzBJHw,"BlueWallet,Lightning"
BlueWallet + SeedSigner: Single Sig Bitcoin Cold Wallet,Robotechy,3/27/22,CQrBlzZAbjs,"BlueWallet,SeedSigner,SeedQR"
Start and Manage a Bitcoin Lightning Node,theBTCcourse,3/25/22,4cRCkhqvUYc,"Thunderhub,Loop,Lightning Network Daemon (LND)"
How to Setup and Use the BitBox02,BitBox,3/22/22,sB4b2PbYaj0,BitBox
BTCPay Server Walkthrough for Absolute Beginners,Vasker Media,3/14/22,sksPq92KYWI,BTCPay Server
Paynyms in Sparrow Wallet- Privacy Preserving Public Bitcoin IDs,BTC Sessions,3/14/22,o-iDeLZ4BiE,"Paynyms (BIP 47),Sparrow,Payjoin"
BTCPay Server Tutorial: How to Accept Bitcoin As Payment or Donation,Ian Major,3/11/22,NQddaMjiQxQ,"BTCPay Server,Umbrel"
How to Setup Nunchuk Wallet,Crypto Blick,3/3/22,APTVdEwBGU8,Nunchuk
ColdCard Seed XOR- Robust Bitcoin Backup,BTC Sessions,2/28/22,RvquutZwNAg,"ColdCard MK(1-4),Seed XOR"
How to Setup a Bitcoin Multisig Wallet (Sparrow),theBTCcourse,2/12/22,p3WV_zgX4fE,"Multisig,Sparrow,Ledger Nano(S/X),BlueWallet"
ColdCard Easy Guide: The 5 Minutes Setup,Coinkite,2/7/22,qNjgs1WJfK0,"ColdCard MK(1-4),Sparrow"
Electrum Wallet Multisig Tutorial,Ian Major,1/28/22,nvE3c7DlNHg,"Electrum,Multisig,Trezor One"
Shakepay Bitcoin Visa- Sats Back on Every Purchase!,BTC Sessions,1/24/22,FbE0yU0WTtM,Shakepay
Get Connected with Lightning Node Connect,Lightning Labs,1/20/22,5kH1ByxjkTM,Lightning Node Connect 
Improving Casa Multisig: Watch-Only Wallet and Sovereign Recovery,Crypto Guide,1/15/22,LmmkAD5UsmY,"Casa,Electrum,Sparrow,ColdCard MK(1-4),Keystone,Multisig"
Casa Managed Multisignature Bitcoin Wallet,Crypto Guide,12/31/21,eCnHYlixqbU,"Casa,Ledger Nano(S/X),Trezor One,Keystone,ColdCard MK(1-4),Multisig"
Opendime Tutorial: Using Bitcoin Like Physical Cash,Ian Major,12/24/21,zsmcHM4C7gs,Opendime
Muun Wallet Review,Darren Honeysett,12/14/21,h3PQc432gI4,"Muun,Lightning"
Trezor One Tutorial,Ian Major,12/10/21,4VKcXuc2LCM,Trezor One
Mercury Wallet- Using Bitcoin Statechains for Privacy,BTC Sessions,12/7/21,SlF_GDscgBw,"Mercury,Statechains"
Jade Bitcoin Hardware Wallet Tutorial,Blockchain Academics,12/6/21,Bn9tLQFlUwM,"Jade,Blockstream App"
How to Buy Non-KYC Bitcoin from a Bitcoin ATM,Ian Major,11/18/21,DnheitmOalQ,Non-KYC
"CoinOS Wallet: Bitcoin On-Chain, Liquid, and Lightning ",BTC Sessions,11/15/21,6wmtPKLeZH0,"Liquid,Lightning"
Ledn Review,Darren Honeysett,11/12/21,GZqW3FMScQU,Ledn
Specter Wallet Tutorial- Bitcoin Multisig with Your Own Node,Ian Major,11/5/21,L07FOsLBVm4,"Specter Desktop,Verifying Downloads,Umbrel,ColdCard MK(1-4),Multisig"
How to Perform Coin Control in Caravan: Manual UTXO Selection,Unchained,11/3/21,_9AWfndN-YU,"Unchained/Caravan,UTXO Management,Multisig"
How to Backup and Restore Multisig Wallets (w/ Sparrow and Specter),BTC Sessions,10/26/21,_X5LygNovLU,"Specter Desktop,Sparrow,Multisig"
BlueWallet Multisig Vault Tutorial,Ian Major,10/15/21,FkDxD5WbNb8,"BlueWallet,ColdCard MK(1-4),Multisig"
Passport Wallet Tutorial- Electrum Desktop (Single Signature),Foundation,10/12/21,mVT7oIIV7zM,"Passport Core,Electrum,Testnet"
"Cryptography Deep Dive: Bitcoin Seeds, Keys, and More",Ian Major,10/11/21,Se2QSp7xjSU,Seed Phrases (General)
Passport Wallet Tutorial- Specter Desktop Setup (Multisignature),Foundation,10/8/21,vDNfw3WWHJ0,"Passport Core,Specter Desktop,ColdCard MK(1-4),Multisig"
Passport Wallet Tutorial- Bitcoin Core Setup (Single Signature),Foundation,10/5/21,HAsDeHWOAko,"Passport Core,Bitcoin Core"
Passport Wallet Tutorial- Wasabi Wallet Setup,Foundation,10/4/21,5200iKvyYKQ,"Passport Core,Wasabi"
Passport Wallet Tutorial- Specter Desktop Setup (Single Signature),Foundation,10/4/21,CPRavH77hKM,"Passport Core,Specter Desktop"
How to Buy Bitcoin in Canada with Shakepay,BTC Sessions,10/4/21,DF75hUz2BAM,Shakepay
How to Set up a Bitcoin Node: Umbrel Tutorial,Darren Honeysett,9/29/21,LfqtAk0k8Fo,"Umbrel,Bitcoin Core"
Connect Your Trezor to Your Umbrel Node,BTC Sessions,9/29/21,ID:-I53fAnQ6t8,"Umbrel,Trezor One,Sparrow"
Passport Wallet Tutorial- Using a Passphrase,Foundation,9/28/21,xo6UULwmgMw,Passport Core
Zebedee Bitcoin Wallet Tutorial,BTC Sessions,9/27/21,gPGzq01B9Qc,"Zebedee,Lightning"
Passport Wallet Tutorial- BlueWallet Set Up (Single Signature),Foundation,9/27/21,8bh7ydaDFQo,"Passport Core,BlueWallet"
Passport Wallet Tutorial- Restoring From Seed,Foundation,9/27/21,hEozTm1EZ-c,Passport Core
Passport Wallet Tutorial- Restoring From Backup File,Foundation,9/27/21,oSy_HXfJTw4,"Passport Core,Encrypted Backups"
Sparrow Wallet Tutorial: The Ultimate Bitcoin Desktop Wallet,Ian Major,9/27/21,GSHyKTigNQY,"Sparrow, Verifying Downloads,Umbrel"
Keystone Bitcoin Only Firmware (Cold Storage Hardware Wallet),Crypto Guide,9/23/21,lBMY8S3nPl0,"Keystone,Seed Phrases (General),BlueWallet,Electrum"
SeedXOR & ColdCard,Coinkite,9/22/21,Vl1KHT_-h_Q,"ColdCard MK(1-4),Seed XOR"
Assembling Your Umbrel Bitcoin Node in 30 Minutes! (Raspberry Pi),Ian Major,9/20/21,sK4x3UkxI-k,Umbrel
Ledn- Bitcoin Backed Loans and Savings,BTC Sessions,9/14/21,I_31ftbRv7U,Ledn
Breez Wallet: Flexibility & Sovereignty for the Bitcoin Lightning Network,Ian Major,9/6/21,Z_yiPM2gzk0,"Breez,Lightning"
Single-Sig Bitcoin Wallet with SeedSigner & Specter Desktop,SeedSigner,8/26/21,LPqvdQ2gSzs,"SeedSigner,Specter Desktop"
Generate Seed Checksum Word & SeedQR Manual Transcription,SeedSigner,8/24/21,c1-PqTNx1vc,"SeedSigner,Seed Phrases (General),SeedQR"
Open Pill Assembly Process,SeedSigner,8/23/21,gXPFJygZobE,SeedSigner
How to Run a Bitcoin Node for Free- Bitcoin Core,BTC Sessions,8/23/21,PXg_xUIYN84,Bitcoin Core
Casa Multisig Bitcoin Security: Platinum Setup and Walkthrough,BTC Sessions,7/28/21,hDok4huHpeE,"Casa,Multisig,Trezor One,Ledger Nano(S/X)"
ColdCard Unboxing & Tutorial,Blockchain Academics,7/24/21,24L1SjV4ar0,"ColdCard MK(1-4),Wasabi"
Bitcoin Core Wallet and Full Node Tutorial,CryptoJar,7/23/21,kUfOBIFSfbg,"Bitcoin Core Wallet,Bitcoin Core"
Muun Wallet- A Beautifully Designed Bitcoin & Lightning Wallet,Ian Major,7/22/21,rQJ8JEWOYHg,"Muun,Lightning"
Keystone Wallet- Secure Your Bitcoin,BTC Sessions,7/12/21,4KDQqj02KK0,"Keystone,Blockstream App,BlueWallet"
Yeti Bitcoin Wallet Level 1 Setup Guide,Yeti Bitcoin Wallet,7/8/21,vNb4UM0Jr7I,Yeti
Yeti Bitcoin Wallet Level 2 Setup Guide,Yeti Bitcoin Wallet,7/8/21,z8oUy8SpYyM,Yeti
BlueWallet Mobile Bitcoin Multisig Using Two Phones,BTC Sessions,7/6/21,RJ7W2NpLRiQ,"BlueWallet,Multisig"
Strike- Send Payments to Anyone in the World for Free,BTC Sessions,6/21/21,4-vJ7zZQ4wU,"Strike,Lightning"
Bisq: Setup and Connect to RoninDojo,b.b. 2k16,5/29/21,VRo8afuQX-E,"Bisq,RoninDojo"
Blockstream Green: How to Set Up a Liquid Wallet,Blockstream,5/28/21,nv9ItZYCw2E,"Blockstream App,Liquid"
Blockstream Green: How to Send Liquid Assets,Blockstream,5/28/21,GYCsdDTypOE,"Blockstream App,Liquid"
Blockstream Green: How to Receive Liquid Assets,Blockstream,5/28/21,l1g6Q7L_QlI,"Liquid,Blockstream App"
Ronin UI Walkthrough (ver 1.10.0),b.b. 2k16,5/26/21,suvUb28AKy0,RoninDojo
How to Install RoninDojo on Raspberry Pi,b.b. 2k16,5/9/21,MGEhumGb0X8,RoninDojo
Sparrow Wallet Tutorial for Bitcoin Beginners,Davani,4/24/21,e_vbPsNdpd0,"Sparrow,Verifying Downloads"
LNBits Point of Sale Tutorial,lnbits,4/23/21,PORsUnkU6Jg,LNbits
ColdCard + Wasabi Wallet = Fully Air-Gapped Bitcoin Transactions,Ian Major,4/21/21,zyxteQDn4u8,"ColdCard MK(1-4),Wasabi"
Child Pays for Parent Bitcoin Transaction Tutorial,Arman the Parman,4/21/21,q0fpuYVJysc,"Child Pays For Parent (CPFP),Electrum"
How to Use Specter Wallet,Coinkite,4/5/21,VWze8xtH72I,"Specter Desktop,Verifying Downloads"
Flash RoninOS to Micro SD Card,b.b. 2k16,4/4/21,RflekkbC08o,RoninDojo
How to Use Bitcoin's Liquid Network,BTC Sessions,3/30/21,jMDRWHBrQUc,"Liquid,Blockstream App"
Yet Bitcoin Wallet Level 3 Setup Guide,Yeti Bitcoin Wallet,3/22/21,xCwSeYLrUb8,Yeti
Fixing Stuck Bitcoin Transactions: Replace by Fee (RBF) and Child Pays for Parent (CPFP),Crypto Guide,3/15/21,LdmoP4Ss1hU,"Replace By Fee (RBF),Child Pays For Parent (CPFP),Electrum"
SeedSigner Build/Orange Pill Assembly,SeedSigner,3/9/21,aIIc2DiZYcI,SeedSigner
Blue Wallet Review,Darren Honeysett,2/28/21,MshoeCKZ570,BlueWallet
How to Create a Bitcoin Wallet on Cake Wallet,Cake Wallet,2/26/21,4SowZV5DrQA,Cake
How to Build a Bitcoin Node,Adam O'Brien,2/26/21,P0yBusy5_Zc,Umbrel
Tutorial Bitcoin Full Node with Umbrel,Plan B Network,2/16/21,O4sFSvtOx58,Umbrel
Why & How to Run a Bitcoin/Lightning Node w/ MyNode,CuriousInventor,2/13/21,3xw-lMBbMds,MyNode
Bitcoin Multisig Wallet with SeedSigner and Specter Desktop,SeedSigner,1/17/21,cC4-ZI638A0,"Specter Desktop,SeedSigner,Multisig"
Verifying Electrum Wallet on Windows using GPG,Arman the Parman,1/5/21,TzOHLL_dKCM,"Electrum,Verifying Downloads"
"Setting Up 2-of-3 Multisig with Specter DIY, Cobo Vault, and paper backup",Specter,12/28/20,xjBzAAiVKk8,"Specter DIY,Keystone,Multisig,Specter Desktop"
Signing Single-Key Transactions with Specter DIY,Specter,12/28/20,BzBlh_knIww,"Specter Desktop,Specter DIY"
Key Generation on Specter DIY,Specter,12/28/20,XfMr7B_uUIk,Specter DIY
Specter DIY Interface: PIN Screen,Specter,12/28/20,Oysg-hhBusc,Specter DIY
BlueWallet: Mobile Multisig Vaults Tutorial,BTC Sessions,12/21/20,E1qcYkSerko,"BlueWallet,ColdCard MK(1-4),Keystone"
How to Use JoinMarket- Bitcoin Privacy Software,Coinkite,12/16/20,9COdlsh4inY,"Coinjoin (JoinMarket),Verifying Downloads"
"Bisq- Buy + Sell Bitcoin No KYC, No ID!",BTC Sessions,12/14/20,4LyEKA5Iq9I,"Bisq,Non-KYC"
Making a Bitcoin Transaction with Electrum,Arman the Parman,12/10/20,ID:-d_Zd7VcAfQ,Electrum
Trezor Model T- How to Use a Bitcoin Hardware Wallet,BTC Sessions,11/16/20,TtlgE2Fx3m8,Trezor T
Bitcoin Green Wallet Tutorial,Plan B Network,11/9/20,yYfug83pAic,Blockstream App
"Electrum Desktop Wallet (Mac/Linux)- Download, Verify, Connect to Your Node",Arman the Parman,11/8/20,wHmQNcRWdHM,"Electrum,Verifying Downloads"
How to Use Fully Noded Bitcoin Wallet,Coinkite,11/8/20,f4gM0wQZUd4,"Fully Noded,ColdCard MK(1-4)"
Live on Bitcoin with Bitrefill,BTC Sessions,11/1/20,B1Kk3GYLMXA,Bitrefill
Specter DIY: Adding User Entropy to the TRNG-Generated Mnemonic,Specter,10/21/20,76p0ADx9gXw,"Specter DIY,Seed Phrases (General)"
RoninDojo Setup Guide,RoninDojo,10/14/20,5CxjRXixg4s,RoninDojo
How to Setup Bitcoin Core,Coinkite,10/6/20,xc_TxlByxeY,"Bitcoin Core,Verifying Downloads"
Trezor Tutorial Part 2: Recover Your Bitcoin from a Private Key,Plan B Network,10/5/20,3n4d4egjiFM,Trezor One
Using Bitaroo's Express Buy Feature,Arman the Parman,10/3/20,duIu6T3wTv0,Bitaroo
How to Use Specter Wallet for Bitcoin Multisig,Bitcoin Magazine,10/1/20,JaWC0FBS6M0,"Specter Desktop,MyNode,Multisig"
Trezor Tutorial Part 1: Setup Process,Plan B Network,9/23/20,q-BlT6R4_bE,Trezor One
How to Use Bitcoin Multisig with Specter,BTC Sessions,9/14/20,ZQvCncdFMPo,"Specter Desktop,Multisig,Ledger Nano(S/X), ColdCard MK(1-4),Keystone"
