title,creator,date,youtubeId,tags
How to Setup and Use Ledger Nano S Privately (ft. Wasabi Wallet),Bitcoin Magazine,9/14/20,RhXn0YvXOcY,"Ledger Nano(S/X),Wasabi"
"2-of-4 Multisig with Trezor, ColdCard, Cobo and Specter DIY using Specter Desktop",Specter,9/3/20,QkGITfauNuU,"Trezor T,ColdCard MK(1-4),Keystone,Specter DIY,Specter Desktop,Multisig"
How and Why to Set Up a Shamir Backup on Trezor T,Bitcoin Takeover,8/28/20,FB289NG2bcM,"Trezor T,Shamir's Secret Sharing (SLIP-39)"
How to Use Bitcoin Multisig: Lily Wallet,BTC Sessions,8/22/20,P5UIvCi9FSM,"Lily,Ledger Nano(S/X),Multisig,ColdCard MK(1-4)"
How to Sovereign Recover an Unchained Capital Vault Using Caravan & Electrum,Nico Moran,8/20/20,NEYuEYCjBiY,"Unchained/Caravan,Electrum,Multisig"
How to Set Up and Spend 2-of-3 Multisig w/ Lily Wallet,Bitcoin Magazine,8/20/20,9xUgyTYqvcQ,"Lily,Multisig,Ledger Nano(S/X),Trezor One,ColdCard MK(1-4)"
Running JoinMarket on the RaspiBlitz,Bitcoin Magazine,8/19/20,uGHRjilMhwY,"Coinjoin (JoinMarket),Raspiblitz"
How to Use BIP 85 Child Seeds with ColdCard and Other Bitcoin Wallets,Coinkite,8/11/20,JvbtMQDPjYE,"ColdCard MK(1-4), Child Seeds (BIP 85),BlueWallet"
Channel Management and RTL Interface in Raspiblitz,Explore Crypto,8/9/20,pESO_Pm0v10,"Raspiblitz,Ride The Lightning"
Setting Up a Multisig Wallet with Specter and Electrum,Specter,8/5/20,4YXklLh2srA,"Specter Desktop,Electrum,Multisig"
How to Set Up the Start9 Embassy Personal Server with Fully Noded,Bitcoin Magazine,7/27/20,YMStLevc034,"Start9,Fully Noded"
ColdCard Passphrase (BIP 39) Features,Coinkite,7/26/20,qeESsHoAbsc,ColdCard MK(1-4)
How to Use Coldpower USB Data Protection for Air-Gap Security,Coinkite,7/24/20,wCZMOfc0jRc,ColdCard MK(1-4)
How to Use Payjoin with BTCPay Server,BTCPay Server,7/18/20,ID:-Wrqv6nSmAM,"Payjoin,BTCPay Server"
How to Sign a Simple PSBT Transaction with ColdCard and Electrum,Coinkite,7/10/20,fNZgVHq0FGM,"ColdCard MK(1-4),Electrum,Partially Signed Bitcoin Transactions (PSBT)"
Trust-Minimized External Recovery,Unchained,7/10/20,WyIKuReOVd0,"Unchained/Caravan,Multisig,Trezor One"
How to Setup a ColdCard Air-Gap Multisig Wallet with Electrum,Coinkite,7/6/20,OMpZ5heLsRg,"ColdCard MK(1-4),Electrum,Multisig"
How to Use a Bitcoin Hardware Wallet: The BitBox02,BTC Sessions,7/1/20,6D4FgJo3j64,BitBox
How to Setup ColdCard with Wasabi Wallet,Coinkite,6/24/20,jOK8j_oCJIQ,"ColdCard MK(1-4),Wasabi"
Multisig Vaults with Phil from Unchained Capital,Guy Swann,6/23/20,OkDGVHbzQ3c,"Unchained/Caravan,Multisig,Trezor One"
Lily Wallet Demo,Kevin Mulcrone,6/23/20,NDDxtnNJl6E,"Lily,Multisig,ColdCard MK(1-4)"
How to Setup ColdCard with Electrum,Coinkite,6/23/20,u5jRJ8L1Vwo,"ColdCard MK(1-4),Electrum"
How to Make a ColdCard Encrypted Backup (MicroSD),Coinkite,6/13/20,n8bS4a6HRyo,"ColdCard MK(1-4),Encrypted Backups"
How to Verify ColdCard's Firmware,Coinkite,6/4/20,RYcB5HpfcaE,"ColdCard MK(1-4),Verifying Downloads"
Using Blockstream Green and a Ledger Nano S to Store Liquid Assets,Blockstream,5/4/20,FHa4ICrdS1w,"Blockstream App,Liquid,Ledger Nano(S/X)"
Using ColdCard with Unchained Capital's Caravan,Kevin Mulcrone,4/28/20,X-JxgTNr0xM,"ColdCard MK(1-4),Unchained/Caravan,Multisig"
How to Get a Bitcoin Wallet: BlueWallet for iPhone and Android,BTC Sessions,4/27/20,imMX7i4qpmg,"BlueWallet,Lightning"
Ronin Dojo- A Backend for Your Samourai Wallet,Ministry of Nodes,4/26/20,7YFrjnfiDS0,RoninDojo
RaspiBlitz DIY Bitcoin Lightning Node,L33T GUY,4/17/20,FJ0qxWbLlz4,"Lightning Network Daemon (LND),Raspiblitz"
"Trezor Model T- Wipe, Recover Seed, and Dry Run Recovery",Crypto Guide,4/3/20,x7HY1CQ9K8A,Trezor T
Blockstream Green 2-of-3 with Hardware Wallets,Blockstream,3/27/20,cy0irnI9tsk,"Blockstream App,Multisig,Ledger Nano(S/X)"
How to Sovereign Recover a Casa Multisig Wallet Using Electrum,Nico Moran,3/19/20,y2oT2_2S5kE,"Casa,Multisig,Electrum"
Getting Started with Specter DIY and Specter Desktop,Specter,3/4/20,eF4cgK_L6T4,"Specter DIY,Specter Desktop,Multisig"
Assembling Specter DIY Hardware Wallet in 5 Minutes,Specter,3/3/20,1H7FqG_FmCw,Specter DIY
Raspberry Pi Zero Project: Trezor,TJ Free,3/3/20,YrKo0QGWIuY,Trezor One
"Multisignature with Hardware Wallets, Bitcoin Core and Specter Desktop",Specter,2/29/20,1t27X-maM7s,"Specter Desktop,Multisig,Trezor T,ColdCard MK(1-4),Specter DIY"
"Wasabi, Electrum, and BlueWallet with MyNode",BTC Sessions,2/21/20,pyylkpR4DDk,"MyNode,Electrum,Wasabi,Blockstream App,BlueWallet"
How to Show Your ColdCard Balance on iPhone,Nico Moran,2/19/20,xWeQwOyEDhI,"ColdCard MK(1-4), BlueWallet"
"myNode- Parts, Assembly, andSoftware Installation",BTC Sessions,2/15/20,GMovZg_3ERs,MyNode
ColdCard Bitcoin Wallet + Electrum- How to Create Multiple Accounts,BTC Sessions,2/7/20,52pjqUzGxDg,"ColdCard MK(1-4),Electrum"
Ubuntu Node Box: JoinMarket,Ministry of Nodes,1/3/20,zTCC86IUzWo,"Ubuntu Node Box,Coinjoin (JoinMarket)"
Bitcoin Core: Import Private Key,Bitcoin Daytrader,12/29/19,8Ev33XGCH8M,Bitcoin Core Wallet
How to Embed Bitcoin Payment Donation Button on a Website,BTCPay Server,12/12/18,MIWGvl6_WzI,BTCPay Server
Caravan Demo,Unchained,11/25/19,9pZaFVF-XbA,"Unchained/Caravan,Multisig"
Caravan Create Address,Unchained,11/14/19,RHpqj-WfIzA,"Unchained/Caravan,Multisig"
Caravan Sign and Broadcast Transaction,Unchained,11/14/19,i6eWbBPuSxs,"Unchained/Caravan,Multisig"
Connecting ColdCard to BTCPay Server,BTCPay Server,9/24/19,N0eVwdP_7EQ,"ColdCard MK(1-4), BTCPay Server"
TFTC Guides: ColdCard + Wasabi Basic Setup and Usage,TFTC,7/23/19,sM2uhyROpAQ,"ColdCard MK(1-4),Wasabi"
How to Use a Bitcoin Wallet: Blockstream Green,BTC Sessions,3/25/19,uO3Zi9D5b0Y,Blockstream App
JoinMarket by Adam Gibson DEMO,Understanding Bitcoin,5/7/19,hwmvZVQ4C4M,"Coinjoin (JoinMarket),Verifying Downloads"
Raspiblitz- Lightning Network Node Setup Tutorial,Explore Crypto,4/1/19,77BBQWg1n8w,"Lightning Network Daemon (LND),Raspiblitz"
How to Create Bitcoin and Lightning Point of Sale,BTCPay Server,12/27/18,Mz4uajz0z9Y,"BTCPay Server,Lightning"
LND Lightning Raspiblitz Basics,IMineBlocks,12/14/18,3beWiV-Phxk,"Lightning Network Daemon (LND),Raspiblitz"
BTCPay Server- Interface Walkthrough,BTCPay Server,12/11/18,ZIfJyq9RimM,BTCPay Server
Getting Your Private Keys from the Bitcoin Core Wallet,Bitcoin Daytrader,12/4/17,OX71C9DP3NE,Bitcoin Core Wallet
Trezor Safe 7: Full Mobile Setup Guide,The CryptoDad,12/3/25,yUxan7xqwjU,Trezor Safe
Trezor Safe 7 Full Tutorial,The CryptoDad,11/12/25,dELBs1f3RqM,Trezor Safe
How to Build and Use a SeedSigner,BTC Sessions,12/29/25,qLCt4RFmtNQ,"SeedSigner,SeedQR,Sparrow"
"Blockstream Jade: Firmware Update, Factory Reset and Vulnerability Fix",Bitcoin Not Crypto,12/25/25,r5Hpfnvas1s,"Jade,Blockstream App"
Seedphrase-only to Passphrase Wallet,Bitcoin Not Crypto,12/24/25,osa3znhlS1c,"Sparrow,ColdCard Q"
Bitcoin Border Wallet Guide,Bitcoin Not Crypto,12/22/25,1MYdCsNySa0,"Sparrow,Border Wallet"
Seedphrase Binary Encoding,Sovereign Money,10/3/25,gyB-QB-qhKg,Seed Phrases (General)
SeedSigner Complete Assembly Tutorial,Sovereign Money,10/9/25,EgjCzdCwxEA,"SeedSigner,Verifying Downloads"
How to Use DIY SeedSigner,Sovereign Money,10/15/25,XQLTwU4u4hk,"SeedSigner,SeedQR,BlueWallet,Sparrow"
Seedphrase Security: Seedkeeper meets SeedSigner,Sovereign Money,10/21/25,_g9dPbCbiPQ,"Seedkeeper,SeedSigner,Verifying Downloads"
SeedSigner + Satochip: No-Compromise Bitcoin Security,Sovereign Money,10/27/25,7EzxrQ3ryxo,"SeedSigner,Satochip,Sparrow"
Braiins Deck Mining Dashboard,BTC Sessions,11/24/25,GPbpI-S7C5I,"Braiins Deck,Braiins Pool"
BitBox02 Nova Full Review,Sovereign Money,11/8/25,2Wjo37oBdCQ,BitBox
OneKey Pro Review,Sovereign Money,11/2/25,L2mpGTS8pe8,"OneKey,Lightning"
Bull Bitcoin Wallet: Full Tutorial,BTC Sessions,10/27/25,6b0xTB2sE8E,"Bull Bitcoin Wallet,Lightning,Liquid,ColdCard Q,Payjoin,Start9,Umbrel,Electrum Rust Server (Electrs),Encrypted Backups"
Generate a Seedphrase Using Dice Rolls and ColdCard Q,Bitcoin Not Crypto,10/21/25,aToKeArNIuo,"ColdCard Q, Seed Phrases (General)"
Wallet of Satoshi Tutorial,BTC Sessions,10/6/25,3yQUhHdjNuc,"Wallet of Satoshi,Bitcoin Well,Lightning,Encrypted Backups"
"What Are UTXOs, and How to Consolidate Them",Bitcoin Not Crypto,9/30/25,fH-mGZU_CI8,"UTXO Management,Sparrow"
How to Make Parent and Child Seed Phrases with ColdCard Q,Bitcoin Not Crypto,10/2/25,7mI4QATw-Bc,"ColdCard Q,Child Seeds (BIP 85)"
Decoy Wallets and Pin Safety with ColdCard Q Bitcoin Wallet,Bitcoin Not Crypto,10/1/25,ICt3zVItA2s,ColdCard Q
ColdCard Spending Policy & 2FA,Coinkite,9/29/25,Qd8ymRwrokg,"ColdCard Q,Nunchuk"
How to Restore Your Bitcoin Wallet from a Backup Using ColdCard Q,Bitcoin Not Crypto,9/23/25,VNxE8oY1mA8,"ColdCard Q,Encrypted Backups"
ColdCard Q Air Gapped w/ Nunchuk on Mobile using QR Code ,Bitcoin Not Crypto,9/20/25,IB-XOphaAE4,"ColdCard Q,Nunchuk"
ColdCard Q Air Gapped w/ Sparrow on Desktop using QR Code,Bitcoin Not Crypto,9/10/25,1ElACsIb8ZA,"ColdCard Q,Sparrow"
How to Setup a Core Lightning Node on Start9,Bitcoin Not Crypto,9/9/25,FmaO73X_ZHY,"Core Lightning,Start9,Ride The Lightning"
Ocean Pool Lightning Payout Settings,Bitcoin Not Crypto,9/1/25,tM2kBjgiY_Y,"DATUM,Bitaxe,Coinos,Sparrow,Lightning,Start9"
How to Pool Mine to Ocean with a Bitaxe,Bitcoin Not Crypto,8/26/25,XSPkyXk9hHU,"DATUM,Bitaxe,Core Lightning,Sparrow,Start9"
How to Solo Mine with a Bitaxe,Bitcoin Not Crypto,8/22/25,LTL7v3QB0v0,"DATUM,Start9,Bitaxe"