title,creator,date,youtubeId,tags
Easily Mine Bitcoin with the Avalon Nano 3S,BTC Sessions,2025-09-01,sO3_c3dfTeU,Avalon Nano 3S
How to use SAMROCK Protocol: Aqua Wallet + BTCPay Server,BTCPay Server,2025-08-28,d9T94kx92yY,"Aqua,BTCPay Server,Lightning,Liquid"
Build Your Own Bitcoin Wallet with SeedSigner,BTC Sessions,2025-08-25,PrrFiyYWcGg,"SeedSigner,Verifying Downloads,Sparrow,Child Seeds (BIP 85),Multisig"
How to Receive with Ginger Wallet,Ginger Wallet,2025-08-23,cqv35wBDWMQ,Ginger
How to Download and Verify Bitcoin Core,Southern Bitcoiner,2025-08-23,vFVeLrE8JpU,"Bitcoin Core,Verifying Downloads"
How to Send with Ginger Wallet,Ginger Wallet,2025-08-15,2nf5aAimfhg,Ginger
ColdCard Co-Sign,BTC Sessions,2025-08-11,6PnTeWTXtzQ,"ColdCard Q,Sparrow"
Nerdaxe Bitcoin Miner Tutorial,BTC Sessions,2025-08-04,zZ5hCo6SUz4,"NerdAxe,Start9"
Recurring Bitcoin Buy Straight to Self-Custody?,Ian Major,2025-07-29,1I5QZjxOW_I,"Bitcoin Well,Sparrow"
ColdCard Q- Quick Tutorial,The Bitcoin Hardware Store,2025-07-29,hK8BV6T1aso,"ColdCard Q,Sparrow"
Sparrow Wallet: Advanced Features Tutorial,BTC Sessions,2025-07-28,ppZ9cPvGTVU,"Sparrow,Paynyms (BIP 47),Verifying Downloads,Border Wallet"
Wasabi Wallet Step-by-Step Tutorial,Sovereign Money,2025-07-23,fsAUhFr1VXU,"Wasabi,Coinjoin (Wabisabi)"
Self-Custody Krux- Hardware Wallet Tutorial,The Bitcoin Hardware Store,2025-07-15,L7uAG5Cyx5o,"Krux,Sparrow"
ColdCard Calculator Mode,TanleyBench,2025-07-12,Ipd2VF6p7oI,ColdCard MK(1-4)
SeedSigner + SeedKeeper Smartcard Hat,Crypto Guide,2025-07-11,KXHVs1-oIdk,"SeedSigner,Seedkeeper"
Blockstream Jade Plus Tutorial,The Bitcoin Hardware Store,2025-07-01,wP9fBUbFH5g,"Jade Plus,Blockstream BTC Wallet"
The Frostsnap Frontier,Frostsnap,2025-06-27,LD99xHqRW8k,"Frostsnap,FROST,Multisig"
Bitcoin Self-Custody for Beginners,The Bitcoin Hardware Store,2025-06-23,ert6T0V1_l4,"BlueWallet,Blockstream BTC Wallet"
Full Zeus Wallet Tutorial,Ian Major,2025-06-17,bDzbKH5dwys,"Zeus,Lightning"
Hodl Hodl: Buy Bitcoin without ID,BTC Sessions,2025-06-16,epLslPQC-EA,"Hodl Hodl,Non-KYC"
Mastering Bitcoin Swaps: On-Chain <-> Lightning,Pioneering Freedom,2025-06-14,8I8yLs9BoTs,"Bitcoin Well,Lightning"
How I Send from a ColdCard Wallet Securely,TanleyBench,2025-06-12,huIIhunURp4,"ColdCard Q,Sparrow"
How to Create a Lightning Node on a DIY Start9,Bitcoin Not Crypto,2025-06-09,2yWvbclNiXg,"Start9,Thunderhub,Lightning"
Muun Bitcoin Wallet,BTC Sessions,2025-06-09,t1rxp8InZW8,"Muun,Lightning"
How to Run a Bitcoin Node on a DIY Start9,Bitcoin Not Crypto,2025-06-07,l8Q-UrPBt9o,"Start9,Bitcoin Knots"
Why You Should Run Your Own Bitcoin Node,Pioneering Freedom,2025-06-04,Bt7eBbqOol0,"Bitcoin Knots,Sparrow,Verifying Downloads"
$300 DIY Mini PC Bitcoin Node (Start9),Bitcoin Not Crypto,2025-06-02,aXVgGLaEEwc,Start9
Building Your Own Hardware Wallet,Crypto Guide,2025-05-30,Yoq99f_pv9w,"Jade,Jade Plus,KeepKey,Krux,Trezor One,Satochip,SeedSigner,Specter DIY,Specter Shield,KeyFlint"
Move Bitcoin from Kraken to Sparrow Wallet Safely,TanleyBench,2025-05-28,g1odIosDnQk,"Kraken,Sparrow"
Canaan Avalon Nano 3S,Avoidbit,2025-05-23,iwj_Dn2KT3k,Avalon Nano 3S
Master Electrum: The Original Bitcoin Power Wallet,BTC Sessions,2025-05-19,NNZdbYd8PUQ,"Electrum,Lightning,ColdCard Q,Jade,Multisig,Umbrel,Start9"
Breez Bitcoin Wallet: Full Tutorial,BTC Sessions,2025-05-12,mibKrTvtlyQ,"Breez,Lightning"
Bitcoin Well Tutorial (Canada),Pioneering Freedom,2025-05-10,gDuh4iKMgfI,"Bitcoin Well,Sparrow"
Set Up ColdCard Without Every Plugging It In (Air-Gapped),TanleyBench,2025-05-10,Y2I7Caxvuzc,"ColdCard Q,Seed Phrases,Sparrow"
How to Coinjoin in Ginger Wallet,Ginger Wallet,2025-05-08,AJe67RDfB1A,"Ginger,Coinjoin (Wabisabi)"
ColdCard Q- Your Ultimate Bitcoin Vault,Satoshi Radio Global,2025-05-07,4hwGh9uA4b8,"ColdCard Q,Sparrow,Nunchuk"
"Bitcoin Knots on Desktop, Umbrel, and Start9",BTC Sessions,2025-05-05,zT4NuAaH3EM,"Bitcoin Knots,Umbrel,Start9"
How to Run Bitcoin Knots on Start9,Southern Bitcoiner,2025-05-05,UxhSelzMcAs,"Bitcoin Knots,Start9,Sparrow"
Key Teleport,Coinkite,2025-05-01,Bg0r0DQVcDg,ColdCard Q
Ginger Wallet in 2 Minutes,Ginger Wallet,2025-04-30,Bzfp8m4KFFs,Ginger
Multisig Recovery Trick,Pioneering Freedom,2025-04-30,WUcH4ljfhs8,"Sparrow,Multisig,ColdCard Q,Keystone"
Bitcoin Multisig Guide: 2-of-3 ColdCard + Keystone Setup with Sparrow Wallet,Pioneering Freedom,2025-04-24,wloTHcNmzJU,"Multisig,Sparrow,ColdCard Q"
"NerdAxe Gamma Unboxing, Setup and Review",Avoidbit,2025-04-23,pMCuopM-1D0,NerdAxe
"Wasabi Wallet: How to Install, Backup Funds, Send Bitcoin",Wasabi Wallet,2025-04-23,tKwGkR3EcJY,"Wasabi,Coinjoin (Wabisabi)"
Phoenix Self-Custody Lightning Wallet Tutorial,BTC Sessions,2025-04-21,TpwnoPUyumA,"Phoenix,Lightning"
ColdCard Q Full Tutorial with Sparrow Wallet,Southern Bitcoiner,2025-04-19,cVGjksyv1uA,"ColdCard Q,Sparrow"
Why You Need Sparrow Bitcoin Wallet Now,BTC Sessions,2025-04-14,yJpvfRl03Tw,"ColdCard Q,Sparrow,Multisig,UTXO Management,Bitcoin Core,Start9,Umbrel"
"How to Securely Update ColdCard Q- Download, Verify and Apply Firmware",Southern Bitcoiner,2025-04-13,xuXOZgc9QCY,"ColdCard Q,Verifying Downloads"
"ColdCard Q Bitcoin Wallet- Unboxing, Setup & Create Wallets",Southern Bitcoiner,2025-04-12,QOJE9EW9xHs,ColdCard Q
Build Your Own Umbrel Bitcoin Node & Mining Pool,Avoidbit,2025-04-09,n9GQ3rFwNI0,"Umbrel,Bitcoin Core"
Using Bitcoin As Collateral for Loans (Debifi + ColdCard),BTC Sessions,2025-04-07,02gzg-en8n0,"Debifi,ColdCard Q,Liquid,USDT"
Complete Nunchuk Wallet Guide,BTC Sessions,2025-03-24,gV4bAjX_ivA,"Nunchuk,ColdCard Q,Tapsigner"
BTCPay Server Tutorial- How to Accept Bitcoin Payments on Your Own Server,Satoshi Radio Global,2025-03-21,p5dFwvsLE1w,"BTCPay Server,Lightning"
How to Lock Down Your Bitcoin for the Future with Liana Wallet,BTC Sessions,2025-03-17,rTId6hfiRm0,"Liana,Multisig,ColdCard MK(1-4),Timelocks"
Ledger Flex Tutorial + Review,BTC Sessions,2025-03-10,V3wnS9_Ieyc,"Ledger Flex,Sparrow"
How to Setup a Bitcoin Hardware Wallet: ColdCard Q,Kahoobb,2025-03-08,4k5EyfZuUgU,ColdCard Q
Proton Wallet Tutorial- The Easiest Bitcoin Wallet?,Darren Honeysett,2025-03-03,QiZEip54SG4,Proton
Build Your Own Bitcoin Hardware Security Device: Krux,BTC Sessions,2025-03-03,WiwmpO1k2zA,"Krux,Verifying Downloads,SeedQR,BlueWallet,Sparrow,Multisig"
Proton Wallet Guide,Sovereign Money,2025-02-28,900wLppZDqs,Proton
Jade Plus Basic Setup,Guy Swann,2025-02-24,itrhljVQ0E8,"Jade Plus,Blockstream BTC Wallet"
The Best Hardware Wallet for Beginners (Bitkey),Rhett Reisman,2025-02-24,R5_w3APq8dU,Bitkey
"Bitcoin UTXOs 101- Management, Consolidation, Fees, and Privacy",Darren Honeysett,2025-02-22,tyah8SB9vhc,UTXO Management
"Verify Wallet Integrity: SHA256 Checksums, Social Verification, GPG + Sparrow",Crypto Guide,2025-02-21,OWazO3nzUPI,"Sparrow,Verifying Downloads,Passport Core,Electrum"
5 Mind Blowing Features for ColdCard,BTC Sessions,2025-02-10,6L2hhT0J27s,"ColdCard Q,Child Seeds (BIP 85)"
How to Setup a Bitaxe Miner (How to Solo Mine),Ryan Matta,2025-02-07,9Us6YcUbgzY,Bitaxe
Liana Tutorial,Bitcoin Education,2025-02-05,JFXTY7Mi7hI,"Liana,ColdCard Q"
Run a Bitcoin Node: Umbrel Home Tutorial,BTC Sessions,2025-02-03,qFfhr4sApso,"Umbrel,Alby,Sparrow"
How to Setup and Use SeedSigner,Ryan Matta,2025-02-03,_1or-gAviI4,"SeedSigner,Sparrow"
Blockstream Jade Wallet Setup Beginner Tutorial,Ryan Matta,2025-01-31,Lq72ejJzEvg,Jade
Anchorwatch's Trident Vault,AnchorWatch,2025-01-29,Lu7nah_dJ_U,"Anchorwatch/Trident,Miniscript"
Coinkite ColdCard Setup Tutorial,Ryan Matta,2025-01-29,UvrH22c3ljk,"ColdCard Q,Tapsigner,Nunchuk"
Bitcoin Node Tutorial,BTC Sessions,2025-01-28,vEWl6sXLpAU,"Bitcoin Core,Sparrow,Gettxoutsetinfo (Audit Supply)"
Bitcoin Multisig Made Easy: Jade and BlueWallet,Sovereign Money,2025-01-28,DOfN447yXOo,"Multisig,SeedQR,Jade,BlueWallet"
Coinkite MK4 Setup Beginner Tutorial,Ryan Matta,2025-01-27,JHHfhxFp_lc,ColdCard MK(1-4)
Aqua: Bitcoin Lightning and Liquid Wallet,Pioneering Freedom,2025-01-27,RTMj3tvIOsQ,"Aqua,Liquid"
AnchorWatch Custody: Vault Configuration,AnchorWatch,2025-01-22,L8QuHwsgbCQ,"Anchorwatch/Trident,Miniscript"
Jade Plus Bitcoin Wallet (Tutorial + Review),BTC Sessions,2025-01-22,rv_cN7F7-TM,"Jade Plus,Blockstream BTC Wallet,Sparrow"
Trezor Safe 5- Full Setup Tutorial,Satoshi Radio Global,2025-01-17,2nhYjCAdIug,"Trezor Safe(3/5),Umbrel"
Futurebit: Mine Bitcoin at Home,BTC Sessions,2025-01-16,t4DbRDJ3p50,Futurebit
How to Restore from Backup Phrase on Trezor Safe 5,The CryptoDad,2025-01-14,hyqDPbcHg78,Trezor Safe(3/5)
Blockstream Jade Plus: Full Setup & Honest Review,Ian Major,2025-01-13,gLHsMC7aJj4,"Jade Plus,Sparrow"
Buying non-KYC Peer to Peer Bitcoin,DaireBTC,2025-01-13,AS3nQYQnEZs,Peach
Blue Wallet Bitcoin Mobile Wallet Beginner Tutorial,Ryan Matta,2025-01-11,-ZJ1DeB6VWw,BlueWallet
Generate and Sign a PSBT,Sovereign Money,2025-01-09,NlaorXeRvCA,"Bitcoin Core,PSBT"
Bitkey: Simple Bitcoin Wallet Tutorial,BTC Sessions,2025-01-07,ccKZDNGhK9M,Bitkey
DATUM Tutorial- Start9 and Umbrel Gateway Setup,Ocean,2025-01-03,Bz64oMzXy8Q,"DATUM,Start9,Umbrel"
Setting up the ColdCard Q Bitcoin Hardware Wallet,JBINZALA,2024-12-26,VoiOSbILwcs,ColdCard Q
Bitkey Wallet Unboxing & Setup,Crypto Bull,2024-12-23,2St52ycnGxU,Bitkey
How to Load a Seed Phrase into Sparrow to Spend from Cold Storage,Adam Soltys,2024-12-20,pIeNHyvipss,Sparrow
How to Generate a Bitcoin Seed Phrase,Adam Soltys,2024-12-20,DARUwbPya5E,Seed Phrases
Bitcoin Keeper: Multisig Inheritance Tutorial,BTC Sessions,2024-12-18,tCld_-n2d30,"Bitcoin Keeper,Tapsigner,Multisig"
How to Set Up Your Own Lightning Node Using Umbrel,Satoshi Radio Global,2024-12-10,i9VTtDPQeZs,"Umbrel,Lightning,Ride The Lightning,Boltz"
Wallet Recovery with Seed Phrase on Trezor Safe 3,Bitcoin Unlocked,2024-12-09,k2O74LM67FA,Trezor Safe(3/5)
Wallet Setup with Trezor Safe (3/5) 3 in Sparrow Using a Passphrase,Bitcoin Unlocked,2024-12-05,ayGNKXcyUAs,"Trezor Safe(3/5),Sparrow"
Bitcoin Core Wallet: Digital Privacy Masterclass,Sovereign Money,2024-12-04,5XgucdLE3gg,Bitcoin Core Wallet
Using Miniscript with the Jade Hardware Wallet and Liana,Blockstream,2024-12-03,b1Ti2Yd0OEI,"Jade,Miniscript,Liana"
Adding a Seed Key and Creating a Multisig Wallet in Bitcoin Keeper,Bithyve,2024-11-18,dVKmLy6rabc,"Bitcoin Keeper,Multisig"
DIY Bitcoin Hardware Wallet with Jade Firmware (ESP 32),Crypto Guide,2024-11-15,EC6b8FfX8oI,Jade
Mining Bitcoin at Home with Datum and Start9,Paul Lamb,2024-11-10,BQ6Hax3wcY8,"Start9,Bitcoin Knots,Core Lightning,Lightning,DATUM"
Securing Your Bitcoin with the OneKey Hardware Wallet,Ian Major,2024-11-07,HTnmwHQWaLA,"OneKey,Verifying Downloads,Alby,Lightning"
Buy Bitcoin Directly Into Your Specter DIY,Get Bittr,2024-11-07,f6w7GtB31j0,"Specter DIY,Bittr"
ColdCard Q: Secure Passwords,Coinkite,2024-11-05,Ir1frVs1gNE,ColdCard Q
Ashigaru- Bitcoin Privacy Wallet Tutorial,BTC Sessions,2024-11-05,aykJ4eP-Veo,"Ashigaru,Coinjoin (Whirlpool),Paynyms (BIP 47)"
Adding Trezor as a Signing Device in Bitcoin Keeper,Bithyve,2024-11-04,7LrAcTLvBhU,"Bitcoin Keeper,Trezor One"
Miniscript on Blockstream Jade,Blockstream,2024-10-30,ARl3dMDVjTA,"Blockstream BTC Wallet,Jade,Liana,Miniscript,Multisig,Timelocks"
Trezor Safe 3 Installation and Setup,Bitcoin Unlocked,2024-10-29,2j-WS5bbyvk,Trezor Safe(3/5)
Ashigaru: Bitcoin Privacy Node DIY Tutorial,BTC Sessions,2024-10-23,ULZoPMCYPfk,"Ashigaru,Dojo,Verifying Downloads"
The Blockstream Jade Bitcoin Cold Wallet: Full Setup and Review,Sovereign Money,2024-10-12,mX6ERYT7790,"Jade,SeedQR,Blockstream BTC Wallet"
Blitz- Cutting Edge Bitcoin Wallet Tutorial,BTC Sessions,2024-10-11,Ka60AHkfrPE,"Blitz,Cashu,Lightning"
Introducing the Theya Web App: Simple & Robust Bitcoin Multisig,Theya,2024-10-08,pGm-I0lUSZo,"Theya,Multisig,Ledger Nano(S/X),Trezor Safe(3/5)"
Build a KeepKey DIY Hardware Wallet,Crypto Guide,2024-10-03,athvFw5eypA,"KeepKey,Verifying Downloads"
ColdCard Q: Disable NFC and USB,Coinkite,2024-10-02,GGqJNTUycs4,ColdCard Q
Spike to Spike: New Way to Buy Bitcoin with No KYC?,Ian Major,2024-09-30,9hzcDvKyWYA,"Spike to Spike,Non-KYC"
ColdCard Q: Unboxing and Setup with Sparrow Wallet,Pioneering Freedom,2024-09-29,Zx4nGt7jaeY,"ColdCard Q,Sparrow"
Braiins Mini Miner: Mine Bitcoin at Home,BTC Sessions,2024-09-25,QXonFfguymw,Braiins Mini Miner
Collaborative Wallet in Bitcoin Keeper,Bithyve,2024-09-24,P4rdQaLjZD0,"Bitcoin Keeper,Multisig"
ColdCard MK(1-4)4: Unboxing and Setup with Sparrow Wallet,Pioneering Freedom,2024-09-24,IM-JxGKa4mc,"ColdCard MK(1-4),Sparrow"
Finding Lost Bitcoin Accounts with Electrum Account Search + Wallet Fingerprint Demo,Crypto Guide,2024-09-19,3rUaAaANpWo,Electrum
Trezor Shamir Backup Setup Warning,Darren Honeysett,2024-09-14,C1pAyiEfvy0,"Trezor One,Trezor T,Trezor Safe(3/5),Shamir's Secret Sharing"
Restoring SeedXOR using Seed Vault,Coinkite,2024-09-13,4F47j9raTvU,"ColdCard Q,Seed XOR"
Alby Hub- Run a Bitcoin Lightning Node Tutorial,BTC Sessions,2024-09-12,2Z1BzwxdP4I,"Alby,Lightning"
Keystone 3 Pro Review and Setup Tutorial,Rhett Reisman,2024-09-12,Wz2jurph4Kk,"Keystone,Nunchuk"
Setting up a Theya Vault with Passport Hardware Wallet,Theya,2024-09-11,u4bTKrrKohY,"Theya,Passport Core"
Alby Hub: The Easy Way to Self-Custody on the Lightning Network,Ian Major,2024-09-11,8BHagtIX0rc,"Alby,Lightning"
BitBox02 Tutorial,Southern Bitcoiner,2024-09-10,sMG6KIB7x2Q,BitBox
Sparrow Wallet Multisig,Sovereign Money,2024-09-07,7y7rxqib78g,"Sparrow,Multisig,Ledger Nano(S/X),Trezor Safe(3/5)"
Ledger Flex: Unboxing and Setup,Unchained,2024-09-06,YmIIZTIE68o,Ledger Flex
Wasabi- Coinjoin Wallet for Bitcoin Privacy,BTC Sessions,2024-09-06,52pSd3I1nac,"Wasabi,Coinjoin (Wabisabi),Verifying Downloads"
Tapsigner: A Smartcard-Based Bitcoin Hardware Wallet,Crypto Guide,2024-09-06,isUqUL1qfBk,"Tapsigner,Nunchuk,Sparrow,ColdCard Q"
Buying Bitcoin Directly into Self-Custody with Theya App,Theya,2024-09-04,vS-DKy3cFJw,Theya
Bitcoin Multisig Self-Custody with Casa,Natalie Brunell,2024-09-04,6x_12Q5EMdw,"Casa,Multisig,Trezor One"
Sparrow Bitcoin Wallet,Sovereign Money,2024-09-02,JNCdYUjiduI,Sparrow
Sparrow Border Wallet,Sovereign Money,2024-08-28,4ycgRfkgTpQ,"Sparrow,Border Wallet"
Bitaxe 401 Supra,Pioneering Freedom,2024-08-25,58fJc2PEtAc,Bitaxe
Blue Wallet: Multi-Hardware Multisig Wallet,Sovereign Money,2024-08-23,tDBNwUIOxe4,"BlueWallet,Multisig"
"Wallet Backup Types: BIP 39 Mnemonic, Passphrase, SLIP39 (Multishare), Multisig",Crypto Guide,2024-08-22,iyfxO1IPTd8,"Seed Phrases,Shamir's Secret Sharing,Multisig"
Buy & Sell With Bitcoin Well,BTC Sessions,2024-08-20,BQ6fuA4_J40,Bitcoin Well
Bitcoin-Only Blue Wallet: Full Intro and Tutorial,Sovereign Money,2024-08-18,u8GhLf7WNS8,"BlueWallet,Multisig"
Sovereign Recovery: Recovering Your Bitcoin from a Theya Vault,Theya,2024-08-08,RRbSpcTrG34,"Theya,Sparrow"
Umbrel Home: The Ultimate Bitcoin Node Solution?,Satoshi Radio Global,2024-08-08,G_Ts4EBjuJY,"Umbrel,Bitcoin Core"
Specter DIY with STM32F469I-DISCO,Crypto Guide,2024-08-08,HOR9bGK57ZA,"Specter DIY,Verifying Downloads,Sparrow,Specter Desktop"
Setting Up a Collaborative Vault in the Theya app,Theya,2024-08-07,ycNAS_9wJqM,"Theya,Multisig,ColdCard MK(1-4)"
The Bitcoin Liquid Network,Sovereign Money,2024-08-03,ymtWl4STiYs,Liquid
Bitcoin Silent Payments & Cake Wallet Tutorial,Ian Major,2024-08-02,payDPlHzp58,"Silent Payments,Cake"
Proton Bitcoin Wallet,BTC Sessions,2024-07-30,tpEh5Bx-n_o,Proton
Mine Bitcoin at Home with NerdAxe,BTC Sessions,2024-07-27,jC-Wp4J4Jb4,NerdAxe
The Bitaxe Supra: Start Mining Bitcoin Today!,Satoshi Radio Global,2024-07-22,InfDHmFQcsE,Bitaxe
Trezor Safe 5 Tutorial,Southern Bitcoiner,2024-07-16,c016Vn6_fRI,Trezor Safe(3/5)
"Trezor Safe 5 Unboxing, Setup and Review",Crypto Guide,2024-07-12,H57nl-1O65Y,Trezor Safe(3/5)
ColdCard Q- Secure Offline Password Manager,BTC Sessions,2024-07-11,SFCqMJIT5PM,"ColdCard Q,Child Seeds (BIP 85)"
Consolidating UTXOs with ColdCard and Keystone 3 Pro,Pioneering Freedom,2024-07-10,VtV2ToHPeBc,"Sparrow,UTXO Management,Keystone,ColdCard MK(1-4)"
UTXO Management,Pioneering Freedom,2024-07-10,DiFKzGR--ng,"UTXO Management,Sparrow"
Seed XOR: Secure Your Bitcoin Like a Pro,Bitcoin Quickies,2024-07-09,iOX4qylU1LY,"Seed XOR,ColdCard Q"
How to Verify Your ColdCard Firmware,Pioneering Freedom,2024-07-06,KwcwTEIWyyE,"Sparrow,ColdCard MK(1-4),Verifying Downloads"
How to Import Your Jade Multisig from Specter to Sparrow Wallet,Blockstream,2024-07-04,GCJyhbRQOtc,"Jade,Sparrow,Specter Desktop,Multisig"
How to Connect Sparrow Wallet to a Start9 Bitcoin Node,Southern Bitcoiner,2024-07-04,t-UDve3Iqnw,"Start9,Bitcoin Core,Electrum Rust Server (Electrs),Sparrow"
Non-KYC Bitcoin: How to Buy Bitcoin with Cash Anonymously,Pioneering Freedom,2024-07-04,BW3JUevo4Qc,"Bitcoin Well,Non-KYC"
Collaborative Wallet: Bitcoin Keeper,Bithyve,2024-07-04,SPawVBHql9M,"Bitcoin Keeper,Multisig"
Multi-app Collaborative Wallet: Bitcoin Keeper,Bithyve,2024-07-04,h_-mu_3q8KA,"Bitcoin Keeper,BlueWallet,Sparrow,Multisig"
Start9 Tutorial: Set up your Bitcoin Node and Personal Server,Southern Bitcoiner,2024-07-02,DzikmY4S42Y,"Start9,Bitcoin Core"
Bitcoin Keeper- Multi Key Security,BTC Sessions,2024-07-01,st9Oe4Dxxl4,"Bitcoin Keeper,Multisig,Tapsigner,ColdCard Q"
Theya: Assisted Recovery for 2-of-3 Multisig Vaults,Theya,2024-06-27,T8-LkN_Fv5k,"Theya,Multisig,ColdCard MK(1-4)"
Stacking Sats Cheaply with Lightning and Liquid Swaps,Blockstream,2024-06-27,S5tv9L818qc,"Blockstream BTC Wallet,Liquid,Boltz,Lightning,Strike"
Trezor Multi-Share Backup,Crypto Guide,2024-06-27,6_7zGA0gMiE,"Trezor T,Shamir's Secret Sharing"
Sparrow Wallet Tutorial,Southern Bitcoiner,2024-06-26,tE-oEQPMrdI,Sparrow
Speed Wallet- Simple BTC Wallet Tutorial,BTC Sessions,2024-06-25,2o8gH-D89HI,"Speed,Lightning"
Using Passport Hardware Wallet with BlueWallet- Multisig,Foundation,2024-06-24,ndS_B8myXPs,"Passport Core,BlueWallet,Multisig,SeedSigner"
How to Buy Anything with Bitcoin: Bitrefill Tutorial,Southern Bitcoiner,2024-06-23,U9BhlTejaEo,"Bitrefill,Lightning"
Using Passport Hardware Wallet with Sparrow- Multisig,Foundation,2024-06-18,zaJS1TVGDeQ,"Passport Core,Sparrow,Multisig,Jade"
How to Save Your Multisig File to Blockstream Jade,Blockstream,2024-06-17,8zpRMMCcetA,"Jade,Multisig,Specter Desktop"
"ColdCard Q Unboxing, Setup and Review",Crypto Guide,2024-06-13,2m5K0RageOI,"ColdCard Q,Sparrow,SeedQR"
ColdCard and Trezor: Setting Up a Multisig Vault in Theya,Theya,2024-06-12,dA4yK__4-M8,"Theya,Multisig,ColdCard MK(1-4),Trezor Safe(3/5)"
Cashu: Bitcoin Wallet for Privacy + Low Fees,BTC Sessions,2024-06-12,LIPw1c74LBU,"Cashu,Phoenix,Lightning,Minibits"
Use Joinmarket JAM App to Increase Privacy,Corner Culture,2024-06-12,xtE1knEcqr8,"JAM,Coinjoin (JoinMarket)"
How to Swap L-BTC and USDT Using a Hardware Wallet,Blockstream,2024-06-05,X616PCJ1-qQ,"Jade,Liquid,USDT"
Theya: Restoring a Mobile Key Backup from iCloud Keychain,Theya,2024-06-05,uelh4niqsxc,Theya
"Using an Unchained Vault with Caravan, Sparrow, and Electrum",Unchained,2024-06-03,rZEZrTFMs9E,"Unchained/Caravan,Sparrow,Electrum"
The Best Bitcoin Multisig (Unchained vs. Casa vs. Nunchuk),Rhett Reisman,2024-06-03,Ito1YJYhc3g,"Unchained/Caravan,Casa,Nunchuk,Multisig"
Mutiny Wallet,BTC Sessions,2024-05-31,bUbee0BUquo,"Mutiny,Lightning,Start9"
Keystone 3 Pro Bitcoin Wallet: Review and Tutorial,Darren Honeysett,2024-05-29,gylEDasHDyQ,"Keystone,Sparrow"
How to Set up a Jade Multisig in Specter Wallet,Blockstream,2024-05-28,tqD3SGtzns4,"Jade,Multisig,Specter Desktop,Umbrel,Bitcoin Core"
Restoring Your Bitcoin Wallet Using Electrum,Bitcoin Learning,2024-05-27,Ph8VZvHdcjk,Electrum
Build a Trezor One DIY Hardware Wallet with STM32 Dev Boards,Crypto Guide,2024-05-24,d4TYYHiM8y8,Trezor One
Funding a Theya Vault & Signing a Bitcoin Transaction,Theya,2024-05-23,P2sFYV6ydZM,"Theya,Ledger Nano(S/X)"
How to Buy Bitcoin with Cash in Canada: Bitcoin Well Cash Vouchers,Darren Honeysett,2024-05-22,kpXY3NrkhP8,"Bitcoin Well,Non-KYC"
How to Improve Bitcoin Privacy with JAM JoinMarket UI,Ian Major,2024-05-20,e8JgwmASuC8,"JAM,Coinjoin (JoinMarket),Umbrel"
Debifi Bitcoin Backed Loans (No Rehypothecation),BTC Sessions,2024-05-18,KIBBtH-y-lg,"Debifi,Liquid,USDT,Blockstream BTC Wallet"
Liana Bitcoin Wallet Tutorial,Wizardsardine,2024-05-16,GppkFrcDrk0,"Liana,Multisig,ColdCard MK(1-4),ColdCard Q"
Bitcoin Passphrases Explain + Sparrow Wallet,Southern Bitcoiner,2024-05-11,CrHMqEnQv7Y,Sparrow
How to Use Ledger with Sparrow Wallet,Pioneering Freedom,2024-05-09,LSSbsKjs6Ao,"Ledger Nano(S/X),Sparrow,Verifying Downloads"
Setting Up a Multisig Bitcoin Vault with Theya,Theya,2024-05-08,kVZIj-Bi7Fw,"Theya,Multisig,Ledger Nano(S/X)"
Restore Peach Wallet in Sparrow,Peach,2024-05-07,_kTYegiDK2Q,"Peach,Sparrow"
ColdCard Q: Unboxing and Setup,Unchained,2024-05-03,vrKSFbnmrrI,ColdCard Q
Bitcoin 10-of-10 Multisig Testing with Sparrow and Nunchuk Wallet,Wicked Smart Bitcoin,2024-04-29,CNkgi1DU7xc,"Nunchuk,Sparrow,Multisig"
Atomic Swaps on Blockstream Jade,Blockstream,2024-04-29,Cm2XQWH2SRc,"Jade,Liquid,USDT"
Trezor Safe 3: The Ultimate Bitcoin Hardware Wallet?,Sovereign Money,2024-04-29,I2D-eChB_zc,Trezor Safe(3/5)
"Fedi: Bitcoin Made Simple, Fast and Cheap",BTC Sessions,2024-04-26,um2VL22R-J0,"Fedi,Fedimints,Lightning,Boltz,Mutiny"
"Aqua: Non-Custodial Bitcoin, Lightning, Liquid",Ian Major,2024-04-26,xmup5ETXI7M,"Aqua,Liquid,Lightning"
Foundation Passport with Envoy and Sparrow,Crypto Guide,2024-04-26,n9EPXCJWTB0,"Passport Core,Envoy,Sparrow,Encrypted Backups"
How to Verify Sparrow Wallet 1.8.3 and Above (using Sparrow's verification tool),Kahoobb,2024-04-25,1UmMVnMx1YE,"Sparrow,Verifying Downloads"
Theya: Setting up a Bitcoin Multisig Vault,Theya,2024-04-22,tcfaC6BXJfk,"Theya,Multisig,ColdCard MK(1-4)"
How to Verify Sparrow Wallet (using command line),Kahoobb,2024-04-21,dAMHOhTO0Bc,"Sparrow,Verifying Downloads"
ColdCard Q Bitcoin Wallet- Air Gapped QR Device for Mobile and Desktop,BTC Sessions,2024-04-15,985bAPKUAV4,"ColdCard Q,Nunchuk,Sparrow"
Evil Replace By Fee (RBF)-er Scenario Walkthrough using Sparrow Wallet,Wicked Smart Bitcoin,2024-04-14,pWmgu5eA4y4,"Sparrow,Replace By Fee (RBF),Child Pays For Parent (CPFP)"
Bitcoin Replace By Fee & Child Pays For Parent Tutorial Using Sparrow Wallet,Wicked Smart Bitcoin,2024-04-13,7EmshGDXi04,"Sparrow,Replace By Fee (RBF),Child Pays For Parent (CPFP)"
Bitcoin Privacy with Wasabi Wallet,Sovereign Money,2024-04-13,REEpl06Fh3k,"Wasabi,Coinjoin (Wabisabi)"
"Verifying Dice Roll Seed Generation with the SeedSigner, ColdCard, & Keystone",Wicked Smart Bitcoin,2024-04-12,mVgPoQrbi7A,"Seed Phrases,SeedSigner,ColdCard Q,Keystone"
How to use the Verificiation Tool in Sparrow Wallet (1.8.4),Pioneering Freedom,2024-04-06,3O4m5AT8hIE,"Sparrow,Verifying Downloads"
Keystone 3 Pro Pro & Sparrow Wallet- Ultimate Air Gapped Solution,Pioneering Freedom,2024-04-05,hkIQuGIg8yM,"Sparrow,Keystone"
How to Manage Your Bitcoin UTXOs in an Unchained Vault,Unchained,2024-04-05,idh-8NJ7ou4,"UTXO Management,Unchained/Caravan"
How to Secure Your Bitcoin with the Keystone 3 Pro,Ian Major,2024-04-05,VBu7-MEevoM,"Keystone,Sparrow"
Parmanode Review,Bitcoin Learning,2024-04-04,-RCYkXRtpoM,Parmanode
The New Keystone 3 Pro BTC-Only Firmware Update,Pioneering Freedom,2024-04-03,Q8vkQSmiktc,Keystone
"How to Set Up Your Sparrow ""Hot"" Wallet",Pioneering Freedom,2024-04-03,2N8-T5GvCyQ,Sparrow
How to Securely Verify Sparrow Wallet and Install,Pioneering Freedom,2024-04-03,6bKaHgEH1hM,"Sparrow, Verifying Downloads"
Tapsigner Recovery Using a ColdCard with Sparrow Wallet,Wicked Smart Bitcoin,2024-03-31,iWh0lfbvdLQ,"Tapsigner,Sparrow,Nunchuk,ColdCard MK(1-4)"
How to Buy Non KYC Bitcoin with Ease (Bisq Tutorial),Ian Major,2024-03-29,BUoiUSUkMGw,"Bisq,Verifying Downloads,Non-KYC"
Multisignature with Blockstream Jade,Blockstream,2024-03-27,XJ5Xckqb4CI,"Jade,Multisig,Specter Desktop,Sparrow"
Importing a ColdCard Bitcoin Wallet (& Labels from Sparrow) into Nunchuk,Wicked Smart Bitcoin,2024-03-24,6ojBttz49cA,"ColdCard MK(1-4),Sparrow,Nunchuk"
How to Buy Bitcoin Straight to Self-Custody with Bitcoin Well,Ian Major,2024-03-22,ze7eOICbg44,Bitcoin Well
How to Verify Bitcoin Software Using Sparrow Wallet,Southern Bitcoiner,2024-03-21,y57EiJuSkqc,"Sparrow,Verifying Downloads"
Krux DIY: Build From Source and Verify (with Windows + WSL2 + Docker),Crypto Guide,2024-03-21,Vmr_TFy2TfQ,"Krux,Verifying Downloads"
Bitcoin Self Custody: Passphrases,Wicked Smart Bitcoin,2024-03-17,RLxi0jU-AXE,"ColdCard MK(1-4),Passport Core,SeedSigner,Sparrow"
Joltz Wallet: First Non-Custodial Bitcoin and Taproot Assets Wallet,Ian Major,2024-03-14,-wVv4R5u9P4,"Joltz,Taproot Assets"
Trezor Wallet: Simple Bitcoin Security,BTC Sessions,2024-03-13,1rrP7QqgcuI,Trezor Safe(3/5)
Boost or Cancel Your Bitcoin Transaction with Envoy,Foundation,2024-03-08,JuiB76jA8Eo,"Envoy,Replace By Fee (RBF),Child Pays For Parent (CPFP)"
SeedSigner + SeedKeeper: Adding Affordable Secure Element Storage to DIY Bitcoin Hardware Wallet,Crypto Guide,2024-02-27,Rhs9z5uL7qg,"SeedSigner,Verifying Downloads"
What is Shamir's Secret Sharing,Blockstream,2024-02-26,O2Wx0B-prSU,Shamir's Secret Sharing
Shamir's Secret Sharing vs. Multisignature: Which is Best?,Blockstream,2024-02-26,g1vus8_yOsw,"Shamir's Secret Sharing,Multisig"
ColdCard Q Bitcoin Wallet- Beginner Tutorial,BTC Sessions,2024-02-20,FiNCG-7EN4A,"ColdCard Q,Sparrow"
Bitcoin UTXO Management with Nunchuk Wallet,Wicked Smart Bitcoin,2024-02-18,BnHLSB08W2M,"UTXO Management,Nunchuk"
ColdCard + Nunchuk- Mobile Bitcoin Security with Virtual Disk Mode,BTC Sessions,2024-02-14,YhReWAJlD6M,"ColdCard MK(1-4),Nunchuk"
Restoring a 2-of-3 Multisig in Nunchuk Desktop From a Config File Without Hardware Wallets,Bitcoin Classroom,2024-02-10,xdXzTEicorw,"Nunchuk,Multisig"
